restaurant_name,rating,area,restaurant_type,price_range,url
The Terrace,4.2,"Hazratganj, Lucknow","North Indian, Continental, Desserts, Beverages, Fast Food, Street Food","₹1,400 for two",https://www.zomato.com/lucknow/the-terrace-2-hazratganj/info
L 14 - Renaissance Lucknow Hotel,4.5,"Renaissance Lucknow Hotel, Lucknow","North Indian, Continental, Fast Food, Asian","₹1,500 for two",https://www.zomato.com/lucknow/l-14-renaissance-lucknow-hotel-gomti-nagar/info
Azrak- Lebua Lucknow,4.2,"lebua Lucknow, Lucknow","North Indian, Hyderabadi, Awadhi, Continental, Desserts, Beverages","₹1,600 for two",https://www.zomato.com/lucknow/azrak-lebua-lucknow-hazratganj/info
Garden Bakery,4.1,"Aliganj, Lucknow","Bakery, Fast Food, Pizza, Pasta, Chinese, Desserts, Coffee, Beverages",₹800 for two,https://www.zomato.com/lucknow/garden-bakery-aliganj/info
On High - Hotel Silvete,4.1,"Hazratganj, Lucknow","North Indian, Chinese, Fast Food, Mughlai, Bar Food, Salad, Beverages, Shake","₹1,100 for two",https://www.zomato.com/lucknow/on-high-hotel-silvete-hazratganj/info
Sahib Cafe - Taj Mahal,4.3,"Taj Mahal, Lucknow, Lucknow","Continental, North Indian, South Indian, Fast Food, Beverages, Chinese","₹2,500 for two",https://www.zomato.com/lucknow/sahib-cafe-taj-mahal-gomti-nagar/info
Saffron Kitchen Restaurant,4.0,"Gomti Nagar, Lucknow","Mughlai, North Indian, Lucknowi, Chinese, Desserts","₹1,000 for two",https://www.zomato.com/lucknow/saffron-kitchen-restaurant-gomti-nagar/info
Mr. Brown - Danbro,4.5,"Aliganj, Lucknow","Bakery, Fast Food, Pizza, Desserts, Beverages",₹500 for two,https://www.zomato.com/lucknow/mr-brown-danbro-aliganj/info
The Square - Novotel,4.1,"Novotel, Gomti Nagar, Lucknow","North Indian, Shake","₹2,000 for two",https://www.zomato.com/lucknow/the-square-novotel-gomti-nagar/info
Molecule Air Bar,4.5,"Riverside Mall, Gomti Nagar, Lucknow","North Indian, Continental, Chinese, Bar Food, Desserts, Beverages","₹1,500 for two",https://www.zomato.com/lucknow/molecule-air-bar-gomti-nagar/info
Moti Mahal,4.3,"Hazratganj, Lucknow","North Indian, Chinese, South Indian, Pizza, Fast Food, Beverages, Desserts",₹800 for two,https://www.zomato.com/lucknow/moti-mahal-hazratganj/info
Mashup Cafe & Bar,4.0,"Gomti Nagar, Lucknow","North Indian, Chinese, Mughlai, Italian, Continental, Pizza, Desserts","₹1,000 for two",https://www.zomato.com/lucknow/mashup-cafe-bar-gomti-nagar/info
Caprice - Radisson Lucknow City Center,4.0,"Aminabad, Lucknow","North Indian, Continental, Fast Food, Healthy Food, Mughlai, Chinese, Desserts","₹1,200 for two",https://www.zomato.com/lucknow/caprice-radisson-lucknow-city-center-aminabad/info
Aadab- Dayal Paradise,4.0,"Hotel Dayal Paradise, Gomti Nagar, Lucknow","North Indian, Mughlai, Continental, Chinese, Shake, Sichuan","₹1,000 for two",https://www.zomato.com/lucknow/aadab-dayal-paradise-gomti-nagar/info
Pirates of Grill,4.8,"Gomti Nagar, Lucknow","North Indian, Mughlai, Continental, Chinese, Desserts","₹2,000 for two",https://www.zomato.com/lucknow/pirates-of-grill-gomti-nagar/info
ZAO,4.5,"Gomti Nagar, Lucknow","Asian, Chinese, Japanese, Korean, Thai, Desserts, Sichuan","₹1,500 for two",https://www.zomato.com/lucknow/zao-1-gomti-nagar/info
Black Brew House,4.0,"Gomti Nagar, Lucknow","North Indian, Pasta, Pizza, Fast Food","₹1,200 for two",https://www.zomato.com/lucknow/black-brew-house-gomti-nagar/info
Bajpayee Kachodi Bhandar,4.3,"Hazratganj, Lucknow","North Indian, Street Food",₹100 for two,https://www.zomato.com/lucknow/bajpayee-kachodi-bhandar-hazratganj/info
Garden Grille & Bar - Hilton Garden Inn,4.1,"Gomti Nagar, Lucknow","North Indian, Continental, Fast Food","₹1,800 for two",https://www.zomato.com/lucknow/garden-grille-bar-hilton-garden-inn-gomti-nagar/info
Distillery,4.3,"Gomti Nagar, Lucknow","North Indian, Chinese, Italian, Street Food, BBQ, Desserts, Beverages, Bar Food","₹1,600 for two",https://www.zomato.com/lucknow/distillery-gomti-nagar/info
Lord of The Drinks,4.6,"Gomti Nagar, Lucknow","North Indian, Chinese, Continental, Pizza, Pasta","₹2,000 for two",https://www.zomato.com/lucknow/lord-of-the-drinks-gomti-nagar/info
Cafe Elaichi - A Pure Veg Desi Delight,4.1,"Gomti Nagar, Lucknow","North Indian, South Indian, Chinese, Fast Food, Street Food, Beverages",₹800 for two,https://www.zomato.com/lucknow/cafe-elaichi-a-pure-veg-desi-delight-gomti-nagar/info
Bikanervala,4.0,"Indira Nagar, Lucknow","North Indian, Mithai, Fast Food, Chinese, South Indian, Desserts, Beverages, Shake",₹500 for two,https://www.zomato.com/lucknow/bikanervala-indira-nagar/info
The Big Grill,4.5,"Phoenix Plassio Mall, Lucknow","North Indian, Chinese, Desserts","₹1,700 for two",https://www.zomato.com/lucknow/the-big-grill-gomti-nagar/info
Tanatan,4.6,"Hazratganj, Lucknow","North Indian, Malwani, Awadhi","₹1,000 for two",https://www.zomato.com/lucknow/tanatan-hazratganj/info
Cafe Repertwahr,4.4,"Indira Nagar, Lucknow","North Indian, Pizza, Chinese, Continental, Italian, Seafood, Salad",₹800 for two,https://www.zomato.com/lucknow/cafe-repertwahr-indira-nagar/info
Mahalaxmi Sweets,4.3,"Aliganj, Lucknow","Mithai, North Indian, South Indian, Chinese, Fast Food, Street Food, Pizza, Beverages",₹500 for two,https://www.zomato.com/lucknow/mahalaxmi-sweets-aliganj/info
Orchid - Fortune Park BBD,4.0,"Fortune Park BBD, Lucknow","North Indian, Continental, Chinese, Fast Food, Desserts, Beverages","₹1,700 for two",https://www.zomato.com/lucknow/orchid-fortune-park-bbd-hazratganj/info
Marine Room - The Piccadily,4.1,"The Piccadily Lucknow, Alambagh, Lucknow","North Indian, Mughlai, Continental, Oriental, Desserts, Kebab, Beverages","₹1,600 for two",https://www.zomato.com/lucknow/marine-room-alambagh/info
Mocha,4.6,"Anand Plaza, Patkapuram, Gomti Nagar, Lucknow","Italian, Continental, North Indian, Fast Food, Desserts, Beverages","₹1,500 for two",https://www.zomato.com/lucknow/mocha-gomti-nagar/info
Net Ram Mithai,4.4,"Aminabad, Lucknow",Mithai,₹200 for two,https://www.zomato.com/lucknow/net-ram-mithai-aminabad/info
Zaika By Gemini Continental Hotel,4.1,"Gemini Continental, Hazratganj, Lucknow","Awadhi, Mughlai, Chinese, Continental, Salad, Italian, Japanese, Thai","₹1,200 for two",https://www.zomato.com/lucknow/zaika-by-gemini-continental-hotel-hazratganj/info
Bigg Daddy,4.4,"Gomti Nagar, Lucknow","Street Food, Chinese, North Indian, Fast Food, Beverages, Italian","₹1,500 for two",https://www.zomato.com/lucknow/bigg-daddy-gomti-nagar/info
Que,4.3,"Gomti Nagar, Lucknow","North Indian, Continental, Chinese, Bar Food, Italian, Fast Food, Street Food, Desserts","₹1,600 for two",https://www.zomato.com/lucknow/que-1-gomti-nagar/info
Madhurima Veg,4.2,"Gomti Nagar, Lucknow","Chinese, Sandwich, Fast Food, North Indian, Pizza, Desserts, South Indian, Burger",₹750 for two,https://www.zomato.com/lucknow/madhurima-veg-1-gomti-nagar/info
Domino's Pizza,4.2,"Alambagh, Lucknow","Pizza, Fast Food",₹300 for two,https://www.zomato.com/lucknow/dominos-pizza-1-alambagh/info
Shri Balaji Dhaba,4.2,"Alambagh, Lucknow",North Indian,₹400 for two,https://www.zomato.com/lucknow/shri-balaji-dhaba-alambagh/info
Unplugged Courtyard,3.9,"Gomti Nagar, Lucknow","North Indian, Continental, Chinese, Desserts, Beverages","₹2,100 for two",https://www.zomato.com/lucknow/unplugged-courtyard-1-gomti-nagar/info
The Drowning Street,4.4,"Gomti Nagar, Lucknow","North Indian, Chinese, Continental, Fast Food, Desserts, Beverages","₹1,200 for two",https://www.zomato.com/lucknow/the-drowning-street-gomti-nagar/info
Masquerade By Mystery Rooms,4.3,"Gomti Nagar, Lucknow","Cafe, Modern Indian, Chinese, North Indian, Continental, Pizza, Pasta, Desserts",₹800 for two,https://www.zomato.com/lucknow/masquerade-by-mystery-rooms-gomti-nagar/info
Raj Luxmi Alambagh,4.2,"Alambagh, Lucknow","North Indian, Awadhi, South Indian, Chinese, Biryani, Fast Food, Desserts",₹400 for two,https://www.zomato.com/lucknow/raj-luxmi-alambagh-alambagh/info
Farzi Café,4.6,"Gomti Nagar, Lucknow","Finger Food, Fast Food, North Indian, Desserts, Beverages","₹1,300 for two",https://www.zomato.com/lucknow/farzi-caf%C3%A9-1-gomti-nagar/info
Skyhilton,4.4,"Alambagh, Lucknow","North Indian, Chinese, Continental, Fast Food, Desserts, Beverages","₹1,500 for two",https://www.zomato.com/lucknow/skyhilton-1-alambagh/info
Mr. Sandwich,4.0,"Khurram Nagar, Lucknow","Fast Food, Sandwich, Desserts, Shake, Beverages",₹300 for two,https://www.zomato.com/lucknow/mr-sandwich-khurram-nagar/info
Mubeen's,4.3,"Chowk, Lucknow",Mughlai,₹300 for two,https://www.zomato.com/lucknow/mubeens-chowk/info
The Posh Pouf,4.0,"Alambagh, Lucknow","North Indian, Chinese, South Indian, Fast Food, Beverages, Pizza, Rolls, Desserts",₹700 for two,https://www.zomato.com/lucknow/the-posh-pouf-alambagh/info
Rajshree Sweets & Restaurant,4.2,"Indira Nagar, Lucknow","Chinese, South Indian, Mithai, Fast Food, Shake, Beverages",₹350 for two,https://www.zomato.com/lucknow/rajshree-sweets-restaurant-indira-nagar/info
B4,4.2,"Gomti Nagar, Lucknow","North Indian, Mughlai, Chinese, Biryani, Fast Food, Street Food, Rolls, Desserts",₹900 for two,https://www.zomato.com/lucknow/b4-gomti-nagar/info
Be The Beer,4.4,"Gomti Nagar, Lucknow","North Indian, Chinese, Italian, Mexican, Fast Food, Desserts, Shake, Beverages","₹1,200 for two",https://www.zomato.com/lucknow/be-the-beer-gomti-nagar/info
Boombox Bar Xchange,4.4,"Gomti Nagar, Lucknow","North Indian, Chinese, Continental, Desserts","₹1,200 for two",https://www.zomato.com/lucknow/boombox-bar-xchange-gomti-nagar/info
Home Sweet Home,4.1,"Hazratganj, Lucknow","Pizza, Continental, Mughlai, North Indian, Chinese, Beverages",₹600 for two,https://www.zomato.com/lucknow/home-sweet-home-hazratganj/info
Vintage Machine,4.5,"Gomti Nagar, Lucknow","Cafe, American, Italian, Lebanese","₹1,000 for two",https://www.zomato.com/lucknow/vintage-machine-gomti-nagar/info
Neelkanth Sweets,4.4,"Gomti Nagar, Lucknow","Mithai, North Indian, Street Food, Beverages",₹300 for two,https://www.zomato.com/lucknow/neelkanth-sweets-gomti-nagar/info
Madhurima Aminabad,4.0,"Aminabad, Lucknow","Street Food, Desserts, South Indian, Chinese",₹500 for two,https://www.zomato.com/lucknow/madhurima-aminabad-aminabad/info
Tamil Nadu Dosa Point,4.1,"Aliganj, Lucknow",South Indian,₹300 for two,https://www.zomato.com/lucknow/tamil-nadu-dosa-point-aliganj/info
The Twilight Kitchen & Bar,4.2,"Jankipuram, Lucknow","North Indian, Continental, Italian, Fast Food, Desserts, Beverages, Finger Food","₹1,400 for two",https://www.zomato.com/lucknow/the-twilight-kitchen-bar-jankipuram/info
Barbeque Nation,4.9,"Riverside Mall, Gomti Nagar, Lucknow","BBQ, Chinese, Mediterranean, North Indian, Desserts, Beverages","₹1,700 for two",https://www.zomato.com/lucknow/barbeque-nation-gomti-nagar/info
Limone Lounge,4.0,"Mahanagar, Lucknow","North Indian, Mughlai, Chinese, Salad, Pizza, Pasta, Fast Food, Beverages",₹800 for two,https://www.zomato.com/lucknow/limone-lounge-mahanagar/info
Madhurima Sweets,4.2,"Gomti Nagar, Lucknow","Chinese, North Indian, South Indian, Biryani, Desserts, Beverages",₹400 for two,https://www.zomato.com/lucknow/madhurima-sweets-gomti-nagar/info
Dhaba - Estd 1986 Delhi,4.1,"Riverside Mall, Gomti Nagar, Lucknow","Mughlai, North Indian, Biryani, Desserts","₹1,400 for two",https://www.zomato.com/lucknow/dhaba-estd-1986-delhi-gomti-nagar/info
Balaji Bhojnalay,4.2,"Charbagh, Lucknow","North Indian, Chinese",₹200 for two,https://www.zomato.com/lucknow/balaji-bhojnalay-charbagh/info
Capoor & Sons,4.4,"Gomti Nagar, Lucknow","Cafe, Mughlai, Continental, Desserts, Fast Food, Chinese, Italian, North Indian","₹1,000 for two",https://www.zomato.com/lucknow/capoor-sons-gomti-nagar/info
Punjab Grill,4.3,"Gomti Nagar, Lucknow","North Indian, Mughlai, Desserts, Beverages",₹800 for two,https://www.zomato.com/lucknow/punjab-grill-gomti-nagar/info
The Centurion,4.4,"Gomti Nagar, Lucknow","North Indian, Continental, Chinese, Italian, Awadhi, Pasta","₹1,800 for two",https://www.zomato.com/lucknow/the-centurion-gomti-nagar/info
Royal Sky,4.3,"Hazratganj, Lucknow","North Indian, Mughlai, Chinese, Continental, Sichuan","₹1,100 for two",https://www.zomato.com/lucknow/royal-sky-1-hazratganj/info
Spice Sutra,4.2,"Gomti Nagar, Lucknow","North Indian, Fast Food, Beverages, Chinese, Continental, Mughlai, Sichuan",₹700 for two,https://www.zomato.com/lucknow/spice-sutra-1-gomti-nagar/info
Pizza Tavola,4.2,"Indira Nagar, Lucknow",Pizza,₹700 for two,https://www.zomato.com/lucknow/pizza-tavola-1-indira-nagar/info
Laddoo Chanakya,4.0,"Hazratganj, Lucknow","Desserts, Mithai",₹350 for two,https://www.zomato.com/lucknow/laddoo-chanakya-hazratganj/info
Maa Durga Restaurant,4.0,"Alambagh, Lucknow","North Indian, South Indian, Chinese, Fast Food, Momos, Biryani",₹250 for two,https://www.zomato.com/lucknow/maa-durga-restaurant-alambagh/info
Urban Nawabs,4.3,"Mahanagar, Lucknow","North Indian, Fast Food, Rolls, Chinese, Desserts, Momos",₹450 for two,https://www.zomato.com/lucknow/urban-nawabs-mahanagar/info
Dine Out City (DOC),4.1,"Aliganj, Lucknow","North Indian, Chinese, Pizza, Mexican, Asian, Japanese, Thai, Sushi",₹700 for two,https://www.zomato.com/lucknow/dine-out-city-doc-aliganj/info
Best Choice Of Awadh,4.3,"Kanpur Road, Lucknow","North Indian, Continental, Chinese, Italian, Desserts, Shake, Beverages","₹1,000 for two",https://www.zomato.com/lucknow/best-choice-of-awadh-kanpur-road/info
Radheylal Parampara Sweets,4.1,"Alambagh, Lucknow","North Indian, Mithai, Street Food",₹400 for two,https://www.zomato.com/lucknow/radheylal-parampara-sweets-alambagh/info
The Flying Saucer Cafe,4.2,"Gomti Nagar, Lucknow","Cafe, Italian, Continental, Chinese","₹1,200 for two",https://www.zomato.com/lucknow/the-flying-saucer-cafe-gomti-nagar/info
Classic Radhey Sweets,4.0,"Mahanagar, Lucknow","Mithai, Street Food, Desserts",₹300 for two,https://www.zomato.com/lucknow/classic-radhey-sweets-mahanagar/info
Royal Cafe,4.4,"Hazratganj, Lucknow","North Indian, BBQ, Mughlai, Continental, Chinese, Fast Food, Desserts, Beverages",₹550 for two,https://www.zomato.com/lucknow/royal-cafe-hazratganj/info
Sassy Canteen,4.3,"Gomti Nagar, Lucknow","Japanese, North Indian, Chinese, Italian, Beverages","₹1,200 for two",https://www.zomato.com/lucknow/sassy-canteen-gomti-nagar/info
Rocca - Hyatt Regency Lucknow,4.2,"Hyatt Regency Lucknow, Lucknow","Italian, North Indian, European, Fast Food, Desserts, Beverages","₹2,600 for two",https://www.zomato.com/lucknow/rocca-hyatt-regency-lucknow-gomti-nagar/info
Paratha's,4.1,"Gomti Nagar, Lucknow","North Indian, Street Food",₹400 for two,https://www.zomato.com/lucknow/parathas-gomti-nagar/info
EOS Bar & Bistro- Hotel Levana,4.1,"Hotel Levana, Hazratganj, Lucknow","Finger Food, Continental, North Indian, Chinese, Thai","₹2,000 for two",https://www.zomato.com/lucknow/eos-bar-bistro-hotel-levana-hazratganj/info
TasteBud Restaurant,4.2,"Aliganj, Lucknow","North Indian, Chinese, Kebab, Mughlai",₹400 for two,https://www.zomato.com/lucknow/tastebud-restaurant-aliganj/info
The Mughal's Dastarkhwan,4.7,"Lalbagh, Lucknow","Mughlai, Chinese, North Indian, Lucknowi",₹700 for two,https://www.zomato.com/lucknow/the-mughals-dastarkhwan-lalbagh/info
Wise Choice Restaurant & Lounge,4.1,"Gomti Nagar, Lucknow","North Indian, Chinese",₹800 for two,https://www.zomato.com/lucknow/wise-choice-restaurant-lounge-gomti-nagar/info
The Peddler's,4.3,"Sapru Marg, Lucknow","North Indian, Continental, Chinese, Fast Food, Beverages",₹800 for two,https://www.zomato.com/lucknow/the-peddlers-sapru-marg/info
Zync Bar & Lounge,4.2,"Gomti Nagar, Lucknow","Chinese, Mughlai, Awadhi, Beverages",₹900 for two,https://www.zomato.com/lucknow/zync-bar-lounge-gomti-nagar/info
Healthy Panda,4.3,"Gomti Nagar, Lucknow","Healthy Food, Italian, Continental, Sandwich, Salad, Cafe, Beverages",₹800 for two,https://www.zomato.com/lucknow/healthy-panda-1-gomti-nagar/info
Desi Rasoi,4.0,"Indira Nagar, Lucknow",North Indian,₹250 for two,https://www.zomato.com/lucknow/desi-rasoi-1-indira-nagar/info
Arabecue Zaika,4.2,"Aliganj, Lucknow","Lucknowi, North Indian, Biryani",₹500 for two,https://www.zomato.com/lucknow/arabecue-zaika-aliganj/info
Al-Jafran,4.1,"Nirala Nagar, Lucknow",North Indian,₹500 for two,https://www.zomato.com/lucknow/al-jafran-nirala-nagar/info
Maharaja Chaap,4.1,"Aliganj, Lucknow","North Indian, Biryani",₹400 for two,https://www.zomato.com/lucknow/maharaja-chaap-aliganj/info
Goku,4.0,"Gomti Nagar, Lucknow","Japanese, Thai, Korean, Sichuan","₹1,200 for two",https://www.zomato.com/lucknow/goku-gomti-nagar/info
Fabcafe By Fabindia,4.1,"Hazratganj, Lucknow","North Indian, Healthy Food, Street Food, Desserts, Biryani, Beverages",₹900 for two,https://www.zomato.com/lucknow/fabcafe-by-fabindia-hazratganj/info
The Hazelnut Factory,4.5,"Nirala Nagar, Lucknow","Bakery, Mithai, Fast Food, Street Food, Pizza, Desserts, Beverages",₹400 for two,https://www.zomato.com/lucknow/the-hazelnut-factory-nirala-nagar/info
Chung Fa Restaurant,4.2,"Mahanagar, Lucknow","Chinese, Seafood",₹900 for two,https://www.zomato.com/lucknow/chung-fa-restaurant-mahanagar/info
Raj Luxmi,4.0,"Charbagh, Lucknow","Mithai, North Indian, Chinese, South Indian, Street Food, Beverages",₹300 for two,https://www.zomato.com/lucknow/raj-luxmi-charbagh/info
Rattilal's,4.1,"Aminabad, Lucknow","Mithai, Street Food, Juices, Desserts",₹200 for two,https://www.zomato.com/lucknow/rattilals-aminabad/info
Lalla Biryani,4.5,"Chowk, Lucknow","Biryani, North Indian",₹300 for two,https://www.zomato.com/lucknow/lalla-biryani-chowk/info
Tunday Kababi,4.7,"Aminabad, Lucknow","Mughlai, North Indian, Kebab",₹300 for two,https://www.zomato.com/lucknow/tunday-kababi-2-aminabad/info
The Brew Hubb,4.1,"Aliganj, Lucknow","Cafe, Chinese, Beverages, Coffee, Pizza, Fast Food, Sichuan",₹350 for two,https://www.zomato.com/lucknow/the-brew-hubb-aliganj/info
The Chocolate Room,4.2,"Hazratganj, Lucknow","Cafe, Mexican, Fast Food, Salad, Beverages, Desserts, Italian",₹500 for two,https://www.zomato.com/lucknow/the-chocolate-room-hazratganj/info
The Cellar,4.7,"Mahanagar, Lucknow","Fast Food, Pasta, Pizza, Mexican, Salad, Desserts, Beverages",₹850 for two,https://www.zomato.com/lucknow/the-cellar-mahanagar/info
Dhindhora Fine Dine Restaurant,4.4,"Chowk, Lucknow","North Indian, Chinese, Italian, South Indian",₹600 for two,https://www.zomato.com/lucknow/dhindhora-fine-dine-restaurant-chowk/info
Royal Cafe,4.1,"Royal Inn, Hazratganj, Lucknow","Pizza, North Indian, Mughlai, Desserts, Chinese, Biryani, Beverages, Sichuan","₹1,500 for two",https://www.zomato.com/lucknow/royal-cafe-5-hazratganj/info
Dosa Planet,4.5,"Aliganj, Lucknow","South Indian, North Indian, Beverages",₹600 for two,https://www.zomato.com/lucknow/dosa-planet-1-aliganj/info
Marksmen,4.2,"Lalbagh, Lucknow","South Indian, Chinese, Fast Food, Beverages",₹600 for two,https://www.zomato.com/lucknow/marksmen-lalbagh/info
Free Spirit,4.5,"Gomti Nagar, Lucknow","Cafe, Italian, Beverages, Burger, Chinese, Pasta, Pizza, Sandwich",₹600 for two,https://www.zomato.com/lucknow/free-spirit-gomti-nagar/info
Keventers - Milkshakes & Desserts,4.1,"Hazratganj, Lucknow","Shake, Beverages, Desserts, Ice Cream",₹400 for two,https://www.zomato.com/lucknow/keventers-milkshakes-desserts-hazratganj/info
The Terrace Grill - La Place Sarovar Portico,4.0,"La Place Sarovar Portico, Hazratganj, Lucknow","North Indian, Pizza, Mughlai, Fast Food, Oriental, Beverages, Desserts","₹1,500 for two",https://www.zomato.com/lucknow/the-terrace-grill-la-place-sarovar-portico-hazratganj/info
Falak Numa Restaurant - Hotel Clarks Avadh,4.1,"Hotel Clarks Avadh, Hazratganj, Lucknow","North Indian, Lucknowi","₹1,600 for two",https://www.zomato.com/lucknow/falak-numa-restaurant-hotel-clarks-avadh-hazratganj/info
Punjab - The Piccadily,4.1,"The Piccadily Lucknow, Alambagh, Lucknow","North Indian, Mughlai, Awadhi, Desserts, Beverages","₹1,500 for two",https://www.zomato.com/lucknow/punjab-piccadily-alambagh/info
The Cherry Tree Cafe,4.4,"Hazratganj, Lucknow","Coffee, Desserts, Fast Food, Salad, Sandwich, Pizza, Beverages",₹600 for two,https://www.zomato.com/lucknow/the-cherry-tree-cafe-hazratganj/info
KFC,4.0,"Jankipuram, Lucknow","Burger, Fast Food, Biryani, Desserts, Beverages",₹450 for two,https://www.zomato.com/lucknow/kfc-jankipuram/info
Pepperz,4.4,"Transport Nagar, Lucknow","North Indian, Chinese, South Indian, Fast Food, Desserts, Beverages","₹1,200 for two",https://www.zomato.com/lucknow/pepperz-transport-nagar/info
Shree Rajbhog,4.5,"Gomti Nagar, Lucknow","Rajasthani, Gujarati",₹600 for two,https://www.zomato.com/lucknow/shree-rajbhog-gomti-nagar/info
Urban Turban - The Metropolitan Club,4.4,"Metropolitan Club, Gomti Nagar, Lucknow","North Indian, Mughlai, Chinese, Continental, Kebab, Beverages, Sichuan","₹1,500 for two",https://www.zomato.com/lucknow/urban-turban-the-metropolitan-club-gomti-nagar/info
Cappuccino Blast,4.1,"Hazratganj, Lucknow","Cafe, Fast Food, North Indian, Chinese, Italian, Desserts, Shake, Beverages","₹1,000 for two",https://www.zomato.com/lucknow/cappuccino-blast-hazratganj/info
Foodie Baba,4.4,"Aashiana, Lucknow","Burger, Fast Food, Sandwich, Pizza, Pasta, Beverages, Healthy Food, Shake",₹500 for two,https://www.zomato.com/lucknow/foodie-baba-aashiana/info
Baati Chokha,4.5,"Gomti Nagar, Lucknow","North Indian, Desserts, Street Food",₹400 for two,https://www.zomato.com/lucknow/baati-chokha-gomti-nagar/info
Spice Caves,4.5,"Gomti Nagar, Lucknow","North Indian, Chinese, Mughlai, Shake, Sichuan","₹1,000 for two",https://www.zomato.com/spicecaves/info
Curry Leaf,4.5,"Hazratganj, Lucknow","South Indian, Beverages",₹500 for two,https://www.zomato.com/lucknow/curry-leaf-hazratganj/info
Dastarkhwan,4.9,"Kaiserbagh, Lucknow","Mughlai, North Indian, Kebab, Biryani",₹500 for two,https://www.zomato.com/lucknow/dastarkhwan-1-kaiserbagh/info
Cake 'n' Cafe,4.0,"Aashiana, Lucknow","Bakery, Street Food",₹450 for two,https://www.zomato.com/lucknow/cake-n-cafe-aashiana/info
Ttamaasha Bistro Bar,4.0,"Gomti Nagar, Lucknow","North Indian, Italian, Chinese, Fast Food, Shake","₹2,200 for two",https://www.zomato.com/lucknow/ttamaasha-bistro-bar-gomti-nagar/info
Tastes Of Bengal,4.0,"Gomti Nagar, Lucknow",Bengali,₹700 for two,https://www.zomato.com/lucknow/tastes-of-bengal-gomti-nagar/info
Shaukeens The Bistro,4.4,"Aliganj, Lucknow","Chinese, North Indian, Mughlai, Beverages, Shake",₹850 for two,https://www.zomato.com/lucknow/shaukeens-the-bistro-aliganj/info
Sugar & Spice,4.0,"Gomti Nagar, Lucknow","Shake, Desserts, Beverages, Ice Cream, Pizza, Burger, Sandwich, Pasta",₹500 for two,https://www.zomato.com/lucknow/sugar-spice-gomti-nagar/info
Frozen Junction,4.8,"Gomti Nagar, Lucknow","Desserts, Ice Cream, Shake, Beverages",₹300 for two,https://www.zomato.com/lucknow/frozen-junction-gomti-nagar/info
Elev8 Book Cafe - Hotel Levana Suites,4.0,"Hazratganj, Lucknow","Fast Food, Finger Food, Chinese, North Indian, Beverages","₹1,200 for two",https://www.zomato.com/lucknow/elev8-book-cafe-hotel-levana-suites-hazratganj/info
Sardar Ji Ke Mashoor Chhole Bhature - Punjabi Zaika,4.3,"Lalbagh, Lucknow",North Indian,₹200 for two,https://www.zomato.com/lucknow/sardar-ji-ke-mashoor-chhole-bhature-punjabi-zaika-lalbagh/info
Mahesh's Mansarovar,4.2,"Aliganj, Lucknow","North Indian, South Indian, Fast Food, Chinese, Desserts",₹500 for two,https://www.zomato.com/lucknow/maheshs-mansarovar-aliganj/info
Urban Terrace,4.2,"Lineage Hotels, Gomti Nagar, Lucknow","Mughlai, Chinese, Italian, Continental, Desserts, Beverages, North Indian, Oriental","₹1,100 for two",https://www.zomato.com/lucknow/urban-terrace-gomti-nagar/info
Al - Baike,4.1,"Aliganj, Lucknow","Mughlai, Burger, North Indian, Fast Food",₹150 for two,https://www.zomato.com/lucknow/al-baike-aliganj/info
Chinese Station,4.0,"Gomti Nagar, Lucknow","Chinese, Fast Food, Sichuan",₹300 for two,https://www.zomato.com/lucknow/chinese-station-gomti-nagar/info
Walnut,4.3,"Hazratganj, Lucknow","Bakery, Desserts",₹500 for two,https://www.zomato.com/lucknow/walnut-hazratganj/info
Wat-A-Burger - India Ka Burger,4.1,"Gomti Nagar, Lucknow","Burger, Fast Food, Beverages, Desserts, Sandwich",₹300 for two,https://www.zomato.com/lucknow/wat-a-burger-india-ka-burger-gomti-nagar/info
Sign In Cafe,4.2,"Aliganj, Lucknow","North Indian, Chinese, Fast Food, Continental, Beverages, Desserts, Sichuan",₹600 for two,https://www.zomato.com/lucknow/sign-in-cafe-1-aliganj/info
Theka - The Piccadily,4.0,"The Piccadily Lucknow, Alambagh, Lucknow",Finger Food,"₹2,700 for two",https://www.zomato.com/lucknow/theka-piccadily-alambagh/info
Shri Kachodi Corner,4.0,"Chowk, Lucknow","Street Food, North Indian",₹100 for two,https://www.zomato.com/lucknow/shri-kachodi-corner-chowk/info
Cafe WTF,4.1,"Indira Nagar, Lucknow","Cafe, Pizza, Fast Food, Desserts, Beverages, Shake",₹800 for two,https://www.zomato.com/lucknow/cafe-wtf-1-indira-nagar/info
1936 - Lebua Lucknow,4.1,"lebua Lucknow, Lucknow",Italian,"₹2,000 for two",https://www.zomato.com/lucknow/1936-lebua-lucknow-hazratganj/info
Raj & Raj,4.0,"Aashiana, Lucknow","Chinese, Street Food, North Indian, South Indian, Fast Food",₹350 for two,https://www.zomato.com/lucknow/raj-raj-aashiana/info
Mashi Biryani World,4.1,"Lalbagh, Lucknow","Biryani, North Indian",₹350 for two,https://www.zomato.com/lucknow/mashi-biryani-world-lalbagh/info
Coffee Culture,4.1,"Mahanagar, Lucknow","Cafe, Italian, Sandwich, Beverages, Fast Food, Shake, Pizza, Burger",₹800 for two,https://www.zomato.com/lucknow/coffee-culture-1-mahanagar/info
"Acacia - Biriyani, Kebabs & Wraps",4.5,"Gomti Nagar, Lucknow","Wraps, North Indian, Biryani, Mughlai",₹750 for two,https://www.zomato.com/lucknow/acacia-biriyani-kebabs-wraps-1-gomti-nagar/info
